[
    {
        "season": 2026,
        "round": 1,
        "raceName": null,
        "circuit": null,
        "location": {
            "country": null
        },
        "sessions": {
            "FP1": {
                "UTC": "2026-03-06T01:30:00Z",
                "Italia": "06-03-2026\n02:30"
            },
            "FP2": {
                "UTC": "2026-03-06T05:00:00Z",
                "Italia": "06-03-2026\n06:00"
            },
            "FP3": {
                "UTC": "2026-03-07T01:30:00Z",
                "Italia": "07-03-2026\n02:30"
            },
            "QUALIFYING": {
                "UTC": "2026-03-07T05:00:00Z",
                "Italia": "07-03-2026\n06:00"
            },
            "GP": {
                "UTC": "2026-03-08T04:00:00Z",
                "Italia": "08-03-2026\n05:00"
            }
        }
    },
    {
        "season": 2026,
        "round": 2,
        "raceName": null,
        "circuit": null,
        "location": {
            "country": null
        },
        "sessions": {
            "FP1": {
                "UTC": "2026-03-13T03:30:00Z",
                "Italia": "13-03-2026\n04:30"
            },
            "SPRINTQUALIFYING": {
                "UTC": "2026-03-13T07:30:00Z",
                "Italia": "13-03-2026\n08:30"
            },
            "SPRINT": {
                "UTC": "2026-03-14T03:00:00Z",
                "Italia": "14-03-2026\n04:00"
            },
            "QUALIFYING": {
                "UTC": "2026-03-14T07:00:00Z",
                "Italia": "14-03-2026\n08:00"
            },
            "GP": {
                "UTC": "2026-03-15T07:00:00Z",
                "Italia": "15-03-2026\n08:00"
            }
        }
    },
    {
        "season": 2026,
        "round": 3,
        "raceName": null,
        "circuit": null,
        "location": {
            "country": null
        },
        "sessions": {
            "FP1": {
                "UTC": "2026-03-27T02:30:00Z",
                "Italia": "27-03-2026\n03:30"
            },
            "FP2": {
                "UTC": "2026-03-27T06:00:00Z",
                "Italia": "27-03-2026\n07:00"
            },
            "FP3": {
                "UTC": "2026-03-28T02:30:00Z",
                "Italia": "28-03-2026\n03:30"
            },
            "QUALIFYING": {
                "UTC": "2026-03-28T06:00:00Z",
                "Italia": "28-03-2026\n07:00"
            },
            "GP": {
                "UTC": "2026-03-29T05:00:00Z",
                "Italia": "29-03-2026\n07:00"
            }
        }
    },
    {
        "season": 2026,
        "round": 4,
        "raceName": null,
        "circuit": null,
        "location": {
            "country": null
        },
        "sessions": {
            "FP1": {
                "UTC": "2026-04-10T11:30:00Z",
                "Italia": "10-04-2026\n13:30"
            },
            "FP2": {
                "UTC": "2026-04-10T15:00:00Z",
                "Italia": "10-04-2026\n17:00"
            },
            "FP3": {
                "UTC": "2026-04-11T12:30:00Z",
                "Italia": "11-04-2026\n14:30"
            },
            "QUALIFYING": {
                "UTC": "2026-04-11T16:00:00Z",
                "Italia": "11-04-2026\n18:00"
            },
            "GP": {
                "UTC": "2026-04-12T15:00:00Z",
                "Italia": "12-04-2026\n17:00"
            }
        }
    },
    {
        "season": 2026,
        "round": 5,
        "raceName": null,
        "circuit": null,
        "location": {
            "country": null
        },
        "sessions": {
            "FP1": {
                "UTC": "2026-04-17T13:30:00Z",
                "Italia": "17-04-2026\n15:30"
            },
            "FP2": {
                "UTC": "2026-04-17T17:00:00Z",
                "Italia": "17-04-2026\n19:00"
            },
            "FP3": {
                "UTC": "2026-04-18T13:30:00Z",
                "Italia": "18-04-2026\n15:30"
            },
            "QUALIFYING": {
                "UTC": "2026-04-18T17:00:00Z",
                "Italia": "18-04-2026\n19:00"
            },
            "GP": {
                "UTC": "2026-04-19T17:00:00Z",
                "Italia": "19-04-2026\n19:00"
            }
        }
    },
    {
        "season": 2026,
        "round": 6,
        "raceName": null,
        "circuit": null,
        "location": {
            "country": null
        },
        "sessions": {
            "FP1": {
                "UTC": "2026-05-01T16:30:00Z",
                "Italia": "01-05-2026\n18:30"
            },
            "SPRINTQUALIFYING": {
                "UTC": "2026-05-01T20:30:00Z",
                "Italia": "01-05-2026\n22:30"
            },
            "SPRINT": {
                "UTC": "2026-05-02T16:00:00Z",
                "Italia": "02-05-2026\n18:00"
            },
            "QUALIFYING": {
                "UTC": "2026-05-02T20:00:00Z",
                "Italia": "02-05-2026\n22:00"
            },
            "GP": {
                "UTC": "2026-05-03T20:00:00Z",
                "Italia": "03-05-2026\n22:00"
            }
        }
    },
    {
        "season": 2026,
        "round": 7,
        "raceName": null,
        "circuit": null,
        "location": {
            "country": null
        },
        "sessions": {
            "FP1": {
                "UTC": "2026-05-22T16:30:00Z",
                "Italia": "22-05-2026\n18:30"
            },
            "SPRINTQUALIFYING": {
                "UTC": "2026-05-22T20:30:00Z",
                "Italia": "22-05-2026\n22:30"
            },
            "SPRINT": {
                "UTC": "2026-05-23T16:00:00Z",
                "Italia": "23-05-2026\n18:00"
            },
            "QUALIFYING": {
                "UTC": "2026-05-23T20:00:00Z",
                "Italia": "23-05-2026\n22:00"
            },
            "GP": {
                "UTC": "2026-05-24T20:00:00Z",
                "Italia": "24-05-2026\n22:00"
            }
        }
    },
    {
        "season": 2026,
        "round": 8,
        "raceName": null,
        "circuit": null,
        "location": {
            "country": null
        },
        "sessions": {
            "FP1": {
                "UTC": "2026-06-05T11:30:00Z",
                "Italia": "05-06-2026\n13:30"
            },
            "FP2": {
                "UTC": "2026-06-05T15:00:00Z",
                "Italia": "05-06-2026\n17:00"
            },
            "FP3": {
                "UTC": "2026-06-06T10:30:00Z",
                "Italia": "06-06-2026\n12:30"
            },
            "QUALIFYING": {
                "UTC": "2026-06-06T14:00:00Z",
                "Italia": "06-06-2026\n16:00"
            },
            "GP": {
                "UTC": "2026-06-07T13:00:00Z",
                "Italia": "07-06-2026\n15:00"
            }
        }
    },
    {
        "season": 2026,
        "round": 9,
        "raceName": null,
        "circuit": null,
        "location": {
            "country": null
        },
        "sessions": {
            "FP1": {
                "UTC": "2026-06-12T11:30:00Z",
                "Italia": "12-06-2026\n13:30"
            },
            "FP2": {
                "UTC": "2026-06-12T15:00:00Z",
                "Italia": "12-06-2026\n17:00"
            },
            "FP3": {
                "UTC": "2026-06-13T10:30:00Z",
                "Italia": "13-06-2026\n12:30"
            },
            "QUALIFYING": {
                "UTC": "2026-06-13T14:00:00Z",
                "Italia": "13-06-2026\n16:00"
            },
            "GP": {
                "UTC": "2026-06-14T13:00:00Z",
                "Italia": "14-06-2026\n15:00"
            }
        }
    },
    {
        "season": 2026,
        "round": 10,
        "raceName": null,
        "circuit": null,
        "location": {
            "country": null
        },
        "sessions": {
            "FP1": {
                "UTC": "2026-06-26T11:30:00Z",
                "Italia": "26-06-2026\n13:30"
            },
            "FP2": {
                "UTC": "2026-06-26T15:00:00Z",
                "Italia": "26-06-2026\n17:00"
            },
            "FP3": {
                "UTC": "2026-06-27T10:30:00Z",
                "Italia": "27-06-2026\n12:30"
            },
            "QUALIFYING": {
                "UTC": "2026-06-27T14:00:00Z",
                "Italia": "27-06-2026\n16:00"
            },
            "GP": {
                "UTC": "2026-06-28T13:00:00Z",
                "Italia": "28-06-2026\n15:00"
            }
        }
    },
    {
        "season": 2026,
        "round": 11,
        "raceName": null,
        "circuit": null,
        "location": {
            "country": null
        },
        "sessions": {
            "FP1": {
                "UTC": "2026-07-03T11:30:00Z",
                "Italia": "03-07-2026\n13:30"
            },
            "SPRINTQUALIFYING": {
                "UTC": "2026-07-03T15:30:00Z",
                "Italia": "03-07-2026\n17:30"
            },
            "SPRINT": {
                "UTC": "2026-07-04T11:00:00Z",
                "Italia": "04-07-2026\n13:00"
            },
            "QUALIFYING": {
                "UTC": "2026-07-04T15:00:00Z",
                "Italia": "04-07-2026\n17:00"
            },
            "GP": {
                "UTC": "2026-07-05T14:00:00Z",
                "Italia": "05-07-2026\n16:00"
            }
        }
    },
    {
        "season": 2026,
        "round": 12,
        "raceName": null,
        "circuit": null,
        "location": {
            "country": null
        },
        "sessions": {
            "FP1": {
                "UTC": "2026-07-17T11:30:00Z",
                "Italia": "17-07-2026\n13:30"
            },
            "FP2": {
                "UTC": "2026-07-17T15:00:00Z",
                "Italia": "17-07-2026\n17:00"
            },
            "FP3": {
                "UTC": "2026-07-18T10:30:00Z",
                "Italia": "18-07-2026\n12:30"
            },
            "QUALIFYING": {
                "UTC": "2026-07-18T14:00:00Z",
                "Italia": "18-07-2026\n16:00"
            },
            "GP": {
                "UTC": "2026-07-19T13:00:00Z",
                "Italia": "19-07-2026\n15:00"
            }
        }
    },
    {
        "season": 2026,
        "round": 13,
        "raceName": null,
        "circuit": null,
        "location": {
            "country": null
        },
        "sessions": {
            "FP1": {
                "UTC": "2026-07-24T11:30:00Z",
                "Italia": "24-07-2026\n13:30"
            },
            "FP2": {
                "UTC": "2026-07-24T15:00:00Z",
                "Italia": "24-07-2026\n17:00"
            },
            "FP3": {
                "UTC": "2026-07-25T10:30:00Z",
                "Italia": "25-07-2026\n12:30"
            },
            "QUALIFYING": {
                "UTC": "2026-07-25T14:00:00Z",
                "Italia": "25-07-2026\n16:00"
            },
            "GP": {
                "UTC": "2026-07-26T13:00:00Z",
                "Italia": "26-07-2026\n15:00"
            }
        }
    },
    {
        "season": 2026,
        "round": 14,
        "raceName": null,
        "circuit": null,
        "location": {
            "country": null
        },
        "sessions": {
            "FP1": {
                "UTC": "2026-08-21T10:30:00Z",
                "Italia": "21-08-2026\n12:30"
            },
            "SPRINTQUALIFYING": {
                "UTC": "2026-08-21T14:30:00Z",
                "Italia": "21-08-2026\n16:30"
            },
            "SPRINT": {
                "UTC": "2026-08-22T10:00:00Z",
                "Italia": "22-08-2026\n12:00"
            },
            "QUALIFYING": {
                "UTC": "2026-08-22T14:00:00Z",
                "Italia": "22-08-2026\n16:00"
            },
            "GP": {
                "UTC": "2026-08-23T13:00:00Z",
                "Italia": "23-08-2026\n15:00"
            }
        }
    },
    {
        "season": 2026,
        "round": 15,
        "raceName": null,
        "circuit": null,
        "location": {
            "country": null
        },
        "sessions": {
            "FP1": {
                "UTC": "2026-09-04T10:30:00Z",
                "Italia": "04-09-2026\n12:30"
            },
            "FP2": {
                "UTC": "2026-09-04T14:00:00Z",
                "Italia": "04-09-2026\n16:00"
            },
            "FP3": {
                "UTC": "2026-09-05T10:30:00Z",
                "Italia": "05-09-2026\n12:30"
            },
            "QUALIFYING": {
                "UTC": "2026-09-05T14:00:00Z",
                "Italia": "05-09-2026\n16:00"
            },
            "GP": {
                "UTC": "2026-09-06T13:00:00Z",
                "Italia": "06-09-2026\n15:00"
            }
        }
    },
    {
        "season": 2026,
        "round": 16,
        "raceName": null,
        "circuit": null,
        "location": {
            "country": null
        },
        "sessions": {
            "FP1": {
                "UTC": "2026-09-11T11:30:00Z",
                "Italia": "11-09-2026\n13:30"
            },
            "FP2": {
                "UTC": "2026-09-11T15:00:00Z",
                "Italia": "11-09-2026\n17:00"
            },
            "FP3": {
                "UTC": "2026-09-12T10:30:00Z",
                "Italia": "12-09-2026\n12:30"
            },
            "QUALIFYING": {
                "UTC": "2026-09-12T14:00:00Z",
                "Italia": "12-09-2026\n16:00"
            },
            "GP": {
                "UTC": "2026-09-13T13:00:00Z",
                "Italia": "13-09-2026\n15:00"
            }
        }
    },
    {
        "season": 2026,
        "round": 17,
        "raceName": null,
        "circuit": null,
        "location": {
            "country": null
        },
        "sessions": {
            "FP1": {
                "UTC": "2026-09-24T08:30:00Z",
                "Italia": "24-09-2026\n10:30"
            },
            "FP2": {
                "UTC": "2026-09-24T12:00:00Z",
                "Italia": "24-09-2026\n14:00"
            },
            "FP3": {
                "UTC": "2026-09-25T08:30:00Z",
                "Italia": "25-09-2026\n10:30"
            },
            "QUALIFYING": {
                "UTC": "2026-09-25T12:00:00Z",
                "Italia": "25-09-2026\n14:00"
            },
            "GP": {
                "UTC": "2026-09-26T11:00:00Z",
                "Italia": "26-09-2026\n13:00"
            }
        }
    },
    {
        "season": 2026,
        "round": 18,
        "raceName": null,
        "circuit": null,
        "location": {
            "country": null
        },
        "sessions": {
            "FP1": {
                "UTC": "2026-10-09T09:30:00Z",
                "Italia": "09-10-2026\n11:30"
            },
            "SPRINTQUALIFYING": {
                "UTC": "2026-10-09T12:30:00Z",
                "Italia": "09-10-2026\n14:30"
            },
            "SPRINT": {
                "UTC": "2026-10-10T09:00:00Z",
                "Italia": "10-10-2026\n11:00"
            },
            "QUALIFYING": {
                "UTC": "2026-10-10T13:00:00Z",
                "Italia": "10-10-2026\n15:00"
            },
            "GP": {
                "UTC": "2026-10-11T12:00:00Z",
                "Italia": "11-10-2026\n14:00"
            }
        }
    },
    {
        "season": 2026,
        "round": 19,
        "raceName": null,
        "circuit": null,
        "location": {
            "country": null
        },
        "sessions": {
            "FP1": {
                "UTC": "2026-10-23T17:30:00Z",
                "Italia": "23-10-2026\n19:30"
            },
            "FP2": {
                "UTC": "2026-10-23T21:00:00Z",
                "Italia": "23-10-2026\n23:00"
            },
            "FP3": {
                "UTC": "2026-10-24T17:30:00Z",
                "Italia": "24-10-2026\n19:30"
            },
            "QUALIFYING": {
                "UTC": "2026-10-24T21:00:00Z",
                "Italia": "24-10-2026\n23:00"
            },
            "GP": {
                "UTC": "2026-10-25T20:00:00Z",
                "Italia": "25-10-2026\n21:00"
            }
        }
    },
    {
        "season": 2026,
        "round": 20,
        "raceName": null,
        "circuit": null,
        "location": {
            "country": null
        },
        "sessions": {
            "FP1": {
                "UTC": "2026-10-30T18:30:00Z",
                "Italia": "30-10-2026\n19:30"
            },
            "FP2": {
                "UTC": "2026-10-30T22:00:00Z",
                "Italia": "30-10-2026\n23:00"
            },
            "FP3": {
                "UTC": "2026-10-31T17:30:00Z",
                "Italia": "31-10-2026\n18:30"
            },
            "QUALIFYING": {
                "UTC": "2026-10-31T21:00:00Z",
                "Italia": "31-10-2026\n22:00"
            },
            "GP": {
                "UTC": "2026-11-01T20:00:00Z",
                "Italia": "01-11-2026\n21:00"
            }
        }
    },
    {
        "season": 2026,
        "round": 21,
        "raceName": null,
        "circuit": null,
        "location": {
            "country": null
        },
        "sessions": {
            "FP1": {
                "UTC": "2026-11-06T15:30:00Z",
                "Italia": "06-11-2026\n16:30"
            },
            "FP2": {
                "UTC": "2026-11-06T19:00:00Z",
                "Italia": "06-11-2026\n20:00"
            },
            "FP3": {
                "UTC": "2026-11-07T14:30:00Z",
                "Italia": "07-11-2026\n15:30"
            },
            "QUALIFYING": {
                "UTC": "2026-11-07T18:00:00Z",
                "Italia": "07-11-2026\n19:00"
            },
            "GP": {
                "UTC": "2026-11-08T17:00:00Z",
                "Italia": "08-11-2026\n18:00"
            }
        }
    },
    {
        "season": 2026,
        "round": 22,
        "raceName": null,
        "circuit": null,
        "location": {
            "country": null
        },
        "sessions": {
            "FP1": {
                "UTC": "2026-11-20T00:30:00Z",
                "Italia": "20-11-2026\n01:30"
            },
            "FP2": {
                "UTC": "2026-11-20T04:00:00Z",
                "Italia": "20-11-2026\n05:00"
            },
            "FP3": {
                "UTC": "2026-11-21T00:30:00Z",
                "Italia": "21-11-2026\n01:30"
            },
            "QUALIFYING": {
                "UTC": "2026-11-21T04:00:00Z",
                "Italia": "21-11-2026\n05:00"
            },
            "GP": {
                "UTC": "2026-11-22T04:00:00Z",
                "Italia": "22-11-2026\n05:00"
            }
        }
    },
    {
        "season": 2026,
        "round": 23,
        "raceName": null,
        "circuit": null,
        "location": {
            "country": null
        },
        "sessions": {
            "FP1": {
                "UTC": "2026-11-27T13:30:00Z",
                "Italia": "27-11-2026\n14:30"
            },
            "FP2": {
                "UTC": "2026-11-27T17:00:00Z",
                "Italia": "27-11-2026\n18:00"
            },
            "FP3": {
                "UTC": "2026-11-28T14:30:00Z",
                "Italia": "28-11-2026\n15:30"
            },
            "QUALIFYING": {
                "UTC": "2026-11-28T18:00:00Z",
                "Italia": "28-11-2026\n19:00"
            },
            "GP": {
                "UTC": "2026-11-29T16:00:00Z",
                "Italia": "29-11-2026\n17:00"
            }
        }
    },
    {
        "season": 2026,
        "round": 24,
        "raceName": null,
        "circuit": null,
        "location": {
            "country": null
        },
        "sessions": {
            "FP1": {
                "UTC": "2026-12-04T09:30:00Z",
                "Italia": "04-12-2026\n10:30"
            },
            "FP2": {
                "UTC": "2026-12-04T13:00:00Z",
                "Italia": "04-12-2026\n14:00"
            },
            "FP3": {
                "UTC": "2026-12-05T10:30:00Z",
                "Italia": "05-12-2026\n11:30"
            },
            "QUALIFYING": {
                "UTC": "2026-12-05T14:00:00Z",
                "Italia": "05-12-2026\n15:00"
            },
            "GP": {
                "UTC": "2026-12-06T13:00:00Z",
                "Italia": "06-12-2026\n14:00"
            }
        }
    }
]